{
  "$schema": "http://json-schema.org/draft-07/schema#",
  "type": "object",
  "properties": {
    "version": {"type": "string"},
    "generated": {"type": "string"},
    "namespace": {"type": "string"},
    "tools": {
      "type": "array",
      "items": {
        "type": "object",
        "required": ["operationId", "method", "path", "preferred_name"],
        "properties": {
          "operationId": {"type": "string"},
          "method": {"type": "string"},
          "path": {"type": "string"},
          "preferred_name": {"type": "string"},
          "complexity": {"type": "object"}
        }
      }
    }
  }
}

