{"version":"1.0","generated":"2025-08-29T20:18:29.024148Z","namespace":"AmazonDSPMeasurement","tools":[{"operationId":"CheckDSPAudienceResearchEligibility","method":"POST","path":"/dsp/measurement/eligibility/audienceResearch","preferred_name":"CheckDSPAudienceResearchEligibility","complexity":{"score":0,"factors":{"depth":0,"properties":0,"arrays":false},"threshold_exceeded":false,"reason":""}},{"operationId":"CheckDSPBrandLiftEligibility","method":"POST","path":"/dsp/measurement/eligibility/brandLift","preferred_name":"CheckDSPBrandLiftEligibility","complexity":{"score":0,"factors":{"depth":0,"properties":0,"arrays":false},"threshold_exceeded":false,"reason":""}},{"operationId":"CheckDSPCreativeTestingEligibility","method":"POST","path":"/dsp/measurement/eligibility/creativeTesting","preferred_name":"CheckDSPCreativeTestingEligibility","complexity":{"score":0,"factors":{"depth":0,"properties":0,"arrays":false},"threshold_exceeded":false,"reason":""}},{"operationId":"CheckDSPOmnichannelMetricsEligibility","method":"POST","path":"/dsp/measurement/eligibility/omnichannelMetrics","preferred_name":"CheckDSPOmnichannelMetricsEligibility","complexity":{"score":0,"factors":{"depth":0,"properties":0,"arrays":false},"threshold_exceeded":false,"reason":""}},{"operationId":"GetDSPAudienceResearchStudies","method":"GET","path":"/dsp/measurement/studies/audienceResearch","preferred_name":"GetDSPAudienceResearchStudies","complexity":{"score":0,"factors":{"depth":0,"properties":0,"arrays":false},"threshold_exceeded":false,"reason":""}},{"operationId":"CreateDSPAudienceResearchStudy","method":"POST","path":"/dsp/measurement/studies/audienceResearch","preferred_name":"CreateDSPAudienceResearchStudy","complexity":{"score":0,"factors":{"depth":0,"properties":0,"arrays":false},"threshold_exceeded":false,"reason":""}},{"operationId":"UpdateDSPAudienceResearchStudy","method":"PUT","path":"/dsp/measurement/studies/audienceResearch/{studyId}","preferred_name":"UpdateDSPAudienceResearchStudy","complexity":{"score":0,"factors":{"depth":0,"properties":0,"arrays":false},"threshold_exceeded":false,"reason":""}},{"operationId":"GetDSPAudienceResearchStudyResult","method":"GET","path":"/dsp/measurement/studies/audienceResearch/{studyId}/result","preferred_name":"GetDSPAudienceResearchStudyResult","complexity":{"score":0,"factors":{"depth":0,"properties":0,"arrays":false},"threshold_exceeded":false,"reason":""}},{"operationId":"GetDSPBrandLiftStudies","method":"GET","path":"/dsp/measurement/studies/brandLift","preferred_name":"GetDSPBrandLiftStudies","complexity":{"score":0,"factors":{"depth":0,"properties":0,"arrays":false},"threshold_exceeded":false,"reason":""}},{"operationId":"CreateDSPBrandLiftStudies","method":"POST","path":"/dsp/measurement/studies/brandLift","preferred_name":"CreateDSPBrandLiftStudies","complexity":{"score":45,"factors":{"depth":1,"properties":0,"arrays":true},"threshold_exceeded":false,"reason":""}},{"operationId":"UpdateDSPBrandLiftStudies","method":"PUT","path":"/dsp/measurement/studies/brandLift","preferred_name":"UpdateDSPBrandLiftStudies","complexity":{"score":45,"factors":{"depth":1,"properties":0,"arrays":true},"threshold_exceeded":false,"reason":""}},{"operationId":"GetDSPCreativeTestingStudies","method":"GET","path":"/dsp/measurement/studies/creativeTesting","preferred_name":"GetDSPCreativeTestingStudies","complexity":{"score":0,"factors":{"depth":0,"properties":0,"arrays":false},"threshold_exceeded":false,"reason":""}},{"operationId":"CreateDSPCreativeTestingStudy","method":"POST","path":"/dsp/measurement/studies/creativeTesting","preferred_name":"CreateDSPCreativeTestingStudy","complexity":{"score":0,"factors":{"depth":0,"properties":0,"arrays":false},"threshold_exceeded":false,"reason":""}},{"operationId":"UpdateDSPCreativeTestingStudy","method":"PUT","path":"/dsp/measurement/studies/creativeTesting/{studyId}","preferred_name":"UpdateDSPCreativeTestingStudy","complexity":{"score":0,"factors":{"depth":0,"properties":0,"arrays":false},"threshold_exceeded":false,"reason":""}},{"operationId":"GetDSPCreativeTestingStudyResult","method":"GET","path":"/dsp/measurement/studies/creativeTesting/{studyId}/result","preferred_name":"GetDSPCreativeTestingStudyResult","complexity":{"score":0,"factors":{"depth":0,"properties":0,"arrays":false},"threshold_exceeded":false,"reason":""}},{"operationId":"GetDSPOmnichannelMetricsStudies","method":"GET","path":"/dsp/measurement/studies/omnichannelMetrics","preferred_name":"GetDSPOmnichannelMetricsStudies","complexity":{"score":0,"factors":{"depth":0,"properties":0,"arrays":false},"threshold_exceeded":false,"reason":""}},{"operationId":"CreateDSPOmnichannelMetricsStudies","method":"POST","path":"/dsp/measurement/studies/omnichannelMetrics","preferred_name":"CreateDSPOmnichannelMetricsStudies","complexity":{"score":45,"factors":{"depth":1,"properties":0,"arrays":true},"threshold_exceeded":false,"reason":""}},{"operationId":"UpdateDSPOmnichannelMetricsStudies","method":"PUT","path":"/dsp/measurement/studies/omnichannelMetrics","preferred_name":"UpdateDSPOmnichannelMetricsStudies","complexity":{"score":45,"factors":{"depth":1,"properties":0,"arrays":true},"threshold_exceeded":false,"reason":""}},{"operationId":"GetDSPOmnichannelMetricsStudyResult","method":"GET","path":"/dsp/measurement/studies/omnichannelMetrics/{studyId}/result","preferred_name":"GetDSPOmnichannelMetricsStudyResult","complexity":{"score":0,"factors":{"depth":0,"properties":0,"arrays":false},"threshold_exceeded":false,"reason":""}},{"operationId":"CheckPlanningEligibility","method":"POST","path":"/measurement/planning/eligibility","preferred_name":"CheckPlanningEligibility","complexity":{"score":0,"factors":{"depth":0,"properties":0,"arrays":false},"threshold_exceeded":false,"reason":""}},{"operationId":"CancelMeasurementStudies","method":"DELETE","path":"/measurement/studies","preferred_name":"CancelMeasurementStudies","complexity":{"score":0,"factors":{"depth":0,"properties":0,"arrays":false},"threshold_exceeded":false,"reason":""}},{"operationId":"GetStudies","method":"GET","path":"/measurement/studies","preferred_name":"GetStudies","complexity":{"score":0,"factors":{"depth":0,"properties":0,"arrays":false},"threshold_exceeded":false,"reason":""}},{"operationId":"GetDSPBrandLiftStudyResult","method":"GET","path":"/measurement/studies/brandLift/{studyId}/result","preferred_name":"GetDSPBrandLiftStudyResult","complexity":{"score":0,"factors":{"depth":0,"properties":0,"arrays":false},"threshold_exceeded":false,"reason":""}},{"operationId":"GetSurveys","method":"GET","path":"/measurement/studies/surveys","preferred_name":"GetSurveys","complexity":{"score":0,"factors":{"depth":0,"properties":0,"arrays":false},"threshold_exceeded":false,"reason":""}},{"operationId":"CreateSurveys","method":"POST","path":"/measurement/studies/surveys","preferred_name":"CreateSurveys","complexity":{"score":45,"factors":{"depth":1,"properties":0,"arrays":true},"threshold_exceeded":false,"reason":""}},{"operationId":"UpdateSurveys","method":"PUT","path":"/measurement/studies/surveys","preferred_name":"UpdateSurveys","complexity":{"score":45,"factors":{"depth":1,"properties":0,"arrays":true},"threshold_exceeded":false,"reason":""}},{"operationId":"vendorProduct","method":"POST","path":"/measurement/vendorProducts/list","preferred_name":"vendorProduct","complexity":{"score":0,"factors":{"depth":0,"properties":0,"arrays":false},"threshold_exceeded":false,"reason":""}},{"operationId":"omnichannelMetricsBrandSearch","method":"POST","path":"/measurement/vendorProducts/omnichannelMetrics/brands/list","preferred_name":"omnichannelMetricsBrandSearch","complexity":{"score":0,"factors":{"depth":0,"properties":0,"arrays":false},"threshold_exceeded":false,"reason":""}},{"operationId":"vendorProductPolicy","method":"GET","path":"/measurement/vendorProducts/policies","preferred_name":"vendorProductPolicy","complexity":{"score":0,"factors":{"depth":0,"properties":0,"arrays":false},"threshold_exceeded":false,"reason":""}},{"operationId":"vendorProductSurveyQuestionTemplates","method":"GET","path":"/measurement/vendorProducts/surveyQuestionTemplates","preferred_name":"vendorProductSurveyQuestionTemplates","complexity":{"score":0,"factors":{"depth":0,"properties":0,"arrays":false},"threshold_exceeded":false,"reason":""}}]}