{"version":"1.0","generated":"2025-08-29T20:18:36.592047Z","namespace":"AMCRuleAudience","tools":[{"operationId":"createLookalikeAudience","method":"POST","path":"/amc/audiences/lookalike","preferred_name":"createLookalikeAudience","complexity":{"score":0,"factors":{"depth":0,"properties":0,"arrays":false},"threshold_exceeded":false,"reason":""}},{"operationId":"getAllQueryBasedAudiencesByInstanceId","method":"GET","path":"/amc/audiences/query","preferred_name":"getAllQueryBasedAudiencesByInstanceId","complexity":{"score":0,"factors":{"depth":0,"properties":0,"arrays":false},"threshold_exceeded":false,"reason":""}},{"operationId":"createQueryBasedAudience","method":"POST","path":"/amc/audiences/query","preferred_name":"createQueryBasedAudience","complexity":{"score":0,"factors":{"depth":0,"properties":0,"arrays":false},"threshold_exceeded":false,"reason":""}},{"operationId":"deleteQueryBasedAudienceByAudienceExecutionId","method":"DELETE","path":"/amc/audiences/query/{audienceExecutionId}","preferred_name":"deleteQueryBasedAudienceByAudienceExecutionId","complexity":{"score":0,"factors":{"depth":0,"properties":0,"arrays":false},"threshold_exceeded":false,"reason":""}},{"operationId":"getQueryBasedAudienceByAudienceExecutionId","method":"GET","path":"/amc/audiences/query/{audienceExecutionId}","preferred_name":"getQueryBasedAudienceByAudienceExecutionId","complexity":{"score":0,"factors":{"depth":0,"properties":0,"arrays":false},"threshold_exceeded":false,"reason":""}},{"operationId":"updateQueryBasedAudienceByAudienceExecutionId","method":"PUT","path":"/amc/audiences/query/{audienceExecutionId}","preferred_name":"updateQueryBasedAudienceByAudienceExecutionId","complexity":{"score":0,"factors":{"depth":0,"properties":0,"arrays":false},"threshold_exceeded":false,"reason":""}}]}