{"version":"1.0","generated":"2025-08-29T20:18:30.187019Z","namespace":"AmazonAttribution","tools":[{"operationId":"getAdvertisersByProfile","method":"GET","path":"/attribution/advertisers","preferred_name":"getAdvertisersByProfile","complexity":{"score":0,"factors":{"depth":0,"properties":0,"arrays":false},"threshold_exceeded":false,"reason":""}},{"operationId":"getPublishers","method":"GET","path":"/attribution/publishers","preferred_name":"getPublishers","complexity":{"score":0,"factors":{"depth":0,"properties":0,"arrays":false},"threshold_exceeded":false,"reason":""}},{"operationId":"getAttributionTagsByCamp","method":"POST","path":"/attribution/report","preferred_name":"getAttributionTagsByCamp","complexity":{"score":0,"factors":{"depth":0,"properties":0,"arrays":false},"threshold_exceeded":false,"reason":""}},{"operationId":"getPublisherAttributionTagTemplate","method":"GET","path":"/attribution/tags/macroTag","preferred_name":"getPublisherAttributionTagTemplate","complexity":{"score":0,"factors":{"depth":0,"properties":0,"arrays":false},"threshold_exceeded":false,"reason":""}},{"operationId":"getPublisherMacroAttributionTag","method":"GET","path":"/attribution/tags/nonMacroTemplateTag","preferred_name":"getPublisherMacroAttributionTag","complexity":{"score":0,"factors":{"depth":0,"properties":0,"arrays":false},"threshold_exceeded":false,"reason":""}}]}