{"version":"1.0","generated":"2025-08-29T20:18:27.301081Z","namespace":"SponsoredBrandsV4","tools":[{"operationId":"StartMigrationJob","method":"POST","path":"/sb/v4/legacyCampaigns/migrationJob","preferred_name":"StartMigrationJob","complexity":{"score":0,"factors":{"depth":0,"properties":0,"arrays":false},"threshold_exceeded":false,"reason":""}},{"operationId":"MigrationJobResults","method":"POST","path":"/sb/v4/legacyCampaigns/migrationJob/results","preferred_name":"MigrationJobResults","complexity":{"score":0,"factors":{"depth":0,"properties":0,"arrays":false},"threshold_exceeded":false,"reason":""}},{"operationId":"MigrationJobStatus","method":"POST","path":"/sb/v4/legacyCampaigns/migrationJob/status","preferred_name":"MigrationJobStatus","complexity":{"score":0,"factors":{"depth":0,"properties":0,"arrays":false},"threshold_exceeded":false,"reason":""}},{"operationId":"MigrationResults","method":"POST","path":"/sb/v4/legacyCampaigns/overallMigrationResults","preferred_name":"MigrationResults","complexity":{"score":0,"factors":{"depth":0,"properties":0,"arrays":false},"threshold_exceeded":false,"reason":""}}]}