{"version":"1.0","generated":"2025-08-29T20:18:25.415255Z","namespace":"AccountsBilling","tools":[{"operationId":"GetDocument","method":"GET","path":"/billing/documents/{documentId}","preferred_name":"GetDocument","complexity":{"score":0,"factors":{"depth":0,"properties":0,"arrays":false},"threshold_exceeded":false,"reason":""}},{"operationId":"PayInvoices","method":"POST","path":"/billing/invoices/pay","preferred_name":"PayInvoices","complexity":{"score":0,"factors":{"depth":0,"properties":0,"arrays":false},"threshold_exceeded":false,"reason":""}},{"operationId":"bulkGetBillingNotifications","method":"POST","path":"/billing/notifications","preferred_name":"bulkGetBillingNotifications","complexity":{"score":0,"factors":{"depth":0,"properties":0,"arrays":false},"threshold_exceeded":false,"reason":""}},{"operationId":"CreatePaymentAgreements","method":"POST","path":"/billing/paymentAgreements","preferred_name":"CreatePaymentAgreements","complexity":{"score":0,"factors":{"depth":0,"properties":0,"arrays":false},"threshold_exceeded":false,"reason":""}},{"operationId":"GetPaymentAgreements","method":"POST","path":"/billing/paymentAgreements/list","preferred_name":"GetPaymentAgreements","complexity":{"score":0,"factors":{"depth":0,"properties":0,"arrays":false},"threshold_exceeded":false,"reason":""}},{"operationId":"GetCustomerPaymentMethods","method":"POST","path":"/billing/paymentMethods/list","preferred_name":"GetCustomerPaymentMethods","complexity":{"score":0,"factors":{"depth":0,"properties":0,"arrays":false},"threshold_exceeded":false,"reason":""}},{"operationId":"CreatePaymentProfiles","method":"POST","path":"/billing/paymentProfiles","preferred_name":"CreatePaymentProfiles","complexity":{"score":0,"factors":{"depth":0,"properties":0,"arrays":false},"threshold_exceeded":false,"reason":""}},{"operationId":"bulkGetBillingStatus","method":"POST","path":"/billing/statuses","preferred_name":"bulkGetBillingStatus","complexity":{"score":0,"factors":{"depth":0,"properties":0,"arrays":false},"threshold_exceeded":false,"reason":""}},{"operationId":"GetBillingProfileAgreementContent","method":"GET","path":"/billingProfileAgreementContents/{billingProfileAgreementContentId}","preferred_name":"GetBillingProfileAgreementContent","complexity":{"score":0,"factors":{"depth":0,"properties":0,"arrays":false},"threshold_exceeded":false,"reason":""}},{"operationId":"ApplyBillingProfile","method":"POST","path":"/billingProfileUsages","preferred_name":"ApplyBillingProfile","complexity":{"score":0,"factors":{"depth":0,"properties":0,"arrays":false},"threshold_exceeded":false,"reason":""}},{"operationId":"GetBillingProfileUsages","method":"POST","path":"/billingProfileUsages/list","preferred_name":"GetBillingProfileUsages","complexity":{"score":0,"factors":{"depth":0,"properties":0,"arrays":false},"threshold_exceeded":false,"reason":""}},{"operationId":"CreateBillingProfiles","method":"POST","path":"/billingProfiles","preferred_name":"CreateBillingProfiles","complexity":{"score":0,"factors":{"depth":0,"properties":0,"arrays":false},"threshold_exceeded":false,"reason":""}},{"operationId":"UpdateBillingProfiles","method":"PUT","path":"/billingProfiles","preferred_name":"UpdateBillingProfiles","complexity":{"score":0,"factors":{"depth":0,"properties":0,"arrays":false},"threshold_exceeded":false,"reason":""}},{"operationId":"GetBillingProfiles","method":"POST","path":"/billingProfiles/list","preferred_name":"GetBillingProfiles","complexity":{"score":0,"factors":{"depth":0,"properties":0,"arrays":false},"threshold_exceeded":false,"reason":""}},{"operationId":"CreateBillingStatement","method":"POST","path":"/billingStatements","preferred_name":"CreateBillingStatement","complexity":{"score":0,"factors":{"depth":0,"properties":0,"arrays":false},"threshold_exceeded":false,"reason":""}},{"operationId":"GetBillingStatement","method":"GET","path":"/billingStatements/{billingStatementRequestId}","preferred_name":"GetBillingStatement","complexity":{"score":0,"factors":{"depth":0,"properties":0,"arrays":false},"threshold_exceeded":false,"reason":""}},{"operationId":"GetBillingInvoiceSummaries","method":"POST","path":"/invoiceSummaries/list","preferred_name":"GetBillingInvoiceSummaries","complexity":{"score":0,"factors":{"depth":0,"properties":0,"arrays":false},"threshold_exceeded":false,"reason":""}},{"operationId":"getAdvertiserInvoices","method":"GET","path":"/invoices","preferred_name":"getAdvertiserInvoices","complexity":{"score":0,"factors":{"depth":0,"properties":0,"arrays":false},"threshold_exceeded":false,"reason":""}},{"operationId":"getInvoice","method":"GET","path":"/invoices/{invoiceId}","preferred_name":"getInvoice","complexity":{"score":0,"factors":{"depth":0,"properties":0,"arrays":false},"threshold_exceeded":false,"reason":""}}]}