{"version":"1.0","generated":"2025-08-29T20:18:24.667500Z","namespace":"AccountsAdsAccounts","tools":[{"operationId":"RegisterAdsAccount","method":"POST","path":"/adsAccounts","preferred_name":"RegisterAdsAccount","complexity":{"score":0,"factors":{"depth":0,"properties":0,"arrays":false},"threshold_exceeded":false,"reason":""}},{"operationId":"ListAdsAccounts","method":"POST","path":"/adsAccounts/list","preferred_name":"ListAdsAccounts","complexity":{"score":0,"factors":{"depth":0,"properties":0,"arrays":false},"threshold_exceeded":false,"reason":""}},{"operationId":"GetAccount","method":"GET","path":"/adsAccounts/{advertisingAccountId}","preferred_name":"GetAccount","complexity":{"score":0,"factors":{"depth":0,"properties":0,"arrays":false},"threshold_exceeded":false,"reason":""}},{"operationId":"CreateTermsToken","method":"POST","path":"/termsTokens","preferred_name":"CreateTermsToken","complexity":{"score":0,"factors":{"depth":0,"properties":0,"arrays":false},"threshold_exceeded":false,"reason":""}},{"operationId":"GetTermsToken","method":"GET","path":"/termsTokens/{termsToken}","preferred_name":"GetTermsToken","complexity":{"score":0,"factors":{"depth":0,"properties":0,"arrays":false},"threshold_exceeded":false,"reason":""}}]}