{"version":"1.0","generated":"2025-08-29T20:18:26.557130Z","namespace":"StoresAnalytics","tools":[{"operationId":"getAsinEngagementForStore","method":"POST","path":"/stores/{brandEntityId}/asinMetrics","preferred_name":"getAsinEngagementForStore","complexity":{"score":0,"factors":{"depth":0,"properties":0,"arrays":false},"threshold_exceeded":false,"reason":""}},{"operationId":"getInsightsForStoreAPI","method":"POST","path":"/stores/{brandEntityId}/insights","preferred_name":"getInsightsForStoreAPI","complexity":{"score":0,"factors":{"depth":0,"properties":0,"arrays":false},"threshold_exceeded":false,"reason":""}}]}