{"version":"1.0","generated":"2025-08-29T20:18:34.606391Z","namespace":"ReportingMarketingMixModeling","tools":[{"operationId":"listMmmBrandGroups","method":"POST","path":"/mmm/v1/brandGroups/list","preferred_name":"listMmmBrandGroups","complexity":{"score":107,"factors":{"depth":1,"properties":6,"arrays":true},"threshold_exceeded":false,"reason":""}},{"operationId":"createMmmReport","method":"POST","path":"/mmm/v1/reports","preferred_name":"createMmmReport","complexity":{"score":27,"factors":{"depth":1,"properties":6,"arrays":false},"threshold_exceeded":false,"reason":""}},{"operationId":"deleteMmmReport","method":"DELETE","path":"/mmm/v1/reports/{reportId}","preferred_name":"deleteMmmReport","complexity":{"score":0,"factors":{"depth":0,"properties":0,"arrays":false},"threshold_exceeded":false,"reason":""}},{"operationId":"getMmmReport","method":"GET","path":"/mmm/v1/reports/{reportId}","preferred_name":"getMmmReport","complexity":{"score":0,"factors":{"depth":0,"properties":0,"arrays":false},"threshold_exceeded":false,"reason":""}}]}