{"version":"1.0","generated":"2025-08-29T20:18:32.263675Z","namespace":"DataProviderData","tools":[{"operationId":"POST_v2_dp_audiencemetadata","method":"POST","path":"/v2/dp/audiencemetadata/","preferred_name":"POST_v2_dp_audiencemetadata","complexity":{"score":83,"factors":{"depth":1,"properties":9,"arrays":false},"threshold_exceeded":false,"reason":""}},{"operationId":"PUT_v2_dp_audiencemetadata_{audienceId}","method":"PUT","path":"/v2/dp/audiencemetadata/{audienceId}","preferred_name":"PUT_v2_dp_audiencemetadata_{audienceId}","complexity":{"score":75,"factors":{"depth":1,"properties":5,"arrays":false},"threshold_exceeded":false,"reason":""}},{"operationId":"GET_v2_dp_audiencemetadata_{audienceId}","method":"GET","path":"/v2/dp/audiencemetadata/{audienceId}","preferred_name":"GET_v2_dp_audiencemetadata_{audienceId}","complexity":{"score":0,"factors":{"depth":0,"properties":0,"arrays":false},"threshold_exceeded":false,"reason":""}},{"operationId":"PATCH_v2_dp_audience","method":"PATCH","path":"/v2/dp/audience","preferred_name":"PATCH_v2_dp_audience","complexity":{"score":97,"factors":{"depth":1,"properties":1,"arrays":true},"threshold_exceeded":false,"reason":""}},{"operationId":"PATCH_v2_dp_users","method":"PATCH","path":"/v2/dp/users","preferred_name":"PATCH_v2_dp_users","complexity":{"score":99,"factors":{"depth":1,"properties":2,"arrays":true},"threshold_exceeded":false,"reason":""}}]}