{"version":"1.0","generated":"2025-08-29T20:18:36.959477Z","namespace":"AMCAdAudience","tools":[{"operationId":"AmcpLinkRemoveConnectionV2","method":"DELETE","path":"/amc/audiences/connections","preferred_name":"AmcpLinkRemoveConnectionV2","complexity":{"score":0,"factors":{"depth":0,"properties":0,"arrays":false},"threshold_exceeded":false,"reason":""}},{"operationId":"AmcpLinkGetConnectionsV2","method":"GET","path":"/amc/audiences/connections","preferred_name":"AmcpLinkGetConnectionsV2","complexity":{"score":0,"factors":{"depth":0,"properties":0,"arrays":false},"threshold_exceeded":false,"reason":""}},{"operationId":"AmcpLinkAddConnectionV2","method":"POST","path":"/amc/audiences/connections","preferred_name":"AmcpLinkAddConnectionV2","complexity":{"score":0,"factors":{"depth":0,"properties":0,"arrays":false},"threshold_exceeded":false,"reason":""}},{"operationId":"AmcpLinkGetTermsV2","method":"GET","path":"/amc/audiences/connections/terms","preferred_name":"AmcpLinkGetTermsV2","complexity":{"score":0,"factors":{"depth":0,"properties":0,"arrays":false},"threshold_exceeded":false,"reason":""}},{"operationId":"AmcpLinkSetTermsAcceptanceV2","method":"PATCH","path":"/amc/audiences/connections/terms","preferred_name":"AmcpLinkSetTermsAcceptanceV2","complexity":{"score":0,"factors":{"depth":0,"properties":0,"arrays":false},"threshold_exceeded":false,"reason":""}},{"operationId":"CreateAudienceMetadataV2","method":"POST","path":"/amc/audiences/metadata","preferred_name":"CreateAudienceMetadataV2","complexity":{"score":0,"factors":{"depth":0,"properties":0,"arrays":false},"threshold_exceeded":false,"reason":""}},{"operationId":"GetAudienceMetadataV2","method":"GET","path":"/amc/audiences/metadata/{audienceId}","preferred_name":"GetAudienceMetadataV2","complexity":{"score":0,"factors":{"depth":0,"properties":0,"arrays":false},"threshold_exceeded":false,"reason":""}},{"operationId":"UpdateAudienceMetadataV2","method":"PUT","path":"/amc/audiences/metadata/{audienceId}","preferred_name":"UpdateAudienceMetadataV2","complexity":{"score":0,"factors":{"depth":0,"properties":0,"arrays":false},"threshold_exceeded":false,"reason":""}},{"operationId":"ManageAudienceV2","method":"POST","path":"/amc/audiences/records","preferred_name":"ManageAudienceV2","complexity":{"score":0,"factors":{"depth":0,"properties":0,"arrays":false},"threshold_exceeded":false,"reason":""}},{"operationId":"ManageAudienceStatusV2","method":"GET","path":"/amc/audiences/records/{jobRequestId}","preferred_name":"ManageAudienceStatusV2","complexity":{"score":0,"factors":{"depth":0,"properties":0,"arrays":false},"threshold_exceeded":false,"reason":""}}]}